{
  "result_version": "1.0",
  "campaign_id": "OPT-20261001-006",
  "round_id": "R001",
  "trials": [
    {
      "trial_id": "R001-T01",
      "status": "completed",
      "measurements": {
        "dev_pos07": [
          13.3627
        ]
      }
    },
    {
      "trial_id": "R001-T02",
      "status": "completed",
      "measurements": {
        "dev_pos07": [
          0.0226
        ]
      }
    },
    {
      "trial_id": "R001-T03",
      "status": "completed",
      "measurements": {
        "dev_pos07": [
          8.7419
        ]
      }
    },
    {
      "trial_id": "R001-T04",
      "status": "completed",
      "measurements": {
        "dev_pos07": [
          0.7899
        ]
      }
    },
    {
      "trial_id": "R001-T05",
      "status": "completed",
      "measurements": {
        "dev_pos07": [
          0.4599
        ]
      }
    },
    {
      "trial_id": "R001-T06",
      "status": "completed",
      "measurements": {
        "dev_pos07": [
          3.5062
        ]
      }
    }
  ]
}