{
  "result_version": "1.0",
  "campaign_id": "OPT-20261001-266",
  "round_id": "R001",
  "trials": [
    {
      "trial_id": "R001-T01",
      "status": "completed",
      "measurements": {
        "yield_pct": [
          99.3588
        ]
      }
    },
    {
      "trial_id": "R001-T02",
      "status": "completed",
      "measurements": {
        "yield_pct": [
          97.6277
        ]
      }
    },
    {
      "trial_id": "R001-T03",
      "status": "completed",
      "measurements": {
        "yield_pct": [
          100.1606
        ]
      }
    },
    {
      "trial_id": "R001-T04",
      "status": "completed",
      "measurements": {
        "yield_pct": [
          98.3593
        ]
      }
    },
    {
      "trial_id": "R001-T05",
      "status": "completed",
      "measurements": {
        "yield_pct": [
          100.0907
        ]
      }
    },
    {
      "trial_id": "R001-T06",
      "status": "completed",
      "measurements": {
        "yield_pct": [
          97.0753
        ]
      }
    },
    {
      "trial_id": "R001-T07",
      "status": "completed",
      "measurements": {
        "yield_pct": [
          99.5622
        ]
      }
    },
    {
      "trial_id": "R001-T08",
      "status": "completed",
      "measurements": {
        "yield_pct": [
          99.3209
        ]
      }
    }
  ]
}